### ISSUE TITLE
Data-streaming fails with @grpc/grpc-js

### ISSUE THREAD

**Issue by LucasAschenbach** [oven-sh/bun#20284]
### What version of Bun is running?

1.2.15

### What platform is your computer?

Darwin 24.4.0 arm64 arm

### What steps can reproduce the bug?

My bun gRPC client fails to receive data-packets from a gRPC server run with node.js but works when the gRPC server is run with bun instead. That is even after completing a successful TCP handshake and exchanging the initial http2 settings frames with the node server (see `tcpdump` output below). Below is a minimal example for reproduction:

client.ts
```ts
import * as grpc from "@grpc/grpc-js";
import protoLoader from "@grpc/proto-loader";

const PROTO_PATH = new URL("./test.proto", import.meta.url).pathname;
const pkgDef = await protoLoader.load(PROTO_PATH);
const proto = grpc.loadPackageDefinition(pkgDef) as any;

const client = new proto.test.Streamer(
  "localhost:50051",
  grpc.credentials.createInsecure()
);

const call = client.StreamData({});          // send Empty request
call.on("data", (d: { value: number }) => console.log("🎲", d.value));
call.on("error", console.error);
call.on("end", () => console.log("🛑 stream ended"));
```

server.ts
```ts
import * as grpc from "@grpc/grpc-js";
import protoLoader from "@grpc/proto-loader";

const PROTO_PATH = new URL("./test.proto", import.meta.url).pathname;
const pkgDef = await protoLoader.load(PROTO_PATH);
const proto = grpc.loadPackageDefinition(pkgDef) as any;

function streamData(call: grpc.ServerWritableStream<any, { value: number }>) {
  const timer = setInterval(() => call.write({ value: Math.floor(Math.random() * 10_000) }), 100);
  console.log("👥 Client connected from:", call.getPeer());

  // tidy up when client disconnects
  call.on("cancelled", () => {
    console.log("👋 Client disconnected");
    clearInterval(timer);
  });
}

const server = new grpc.Server();
server.addService(proto.test.Streamer.service, { StreamData: streamData });

server.bindAsync("0.0.0.0:50051", grpc.ServerCredentials.createInsecure(), () => {
  console.log("🚀 gRPC server listening on 0.0.0.0:50051");
});
```

test.proto
```proto
syntax = "proto3";
package test;

message Empty {}
message Data {
  int32 value = 1;
}

service Streamer {
  // server-streaming RPC: client sends one Empty, gets infinite Data
  rpc StreamData(Empty) returns (stream Data);
}
```

dependencies:
- "@grpc/grpc-js": "^1.13.4",
- "@grpc/proto-loader": "^0.7.15"

### What is the expected behavior?

In this example the client run with `bun run client.ts` should continuously receive packages from the server run with `tsx server.ts`.

### What do you see instead?

The bun client does not receive a single data package. Strangely, when running the client with `tsx client.ts` everything works fine. Also, when running the server with bun, the bun client does work as expected.

### Additional information

Below is a captured tcpdump output for both the node and bun client talking to the node server.

```
sudo tcpdump -i lo0 -n port 50051 -vv -X
```

<details>
<summary>tsx client.ts</summary>

```
23:32:42.238109 IP6 (flowlabel 0x60e00, hlim 64, next-header TCP (6) payload length: 44) ::1.63361 > ::1.50051: Flags [S], cksum 0x0034 (incorrect -> 0x7759), seq 3886956025, win 65535, options [mss 16324,nop,wscale 6,nop,nop,TS val 3638742016 ecr 0,sackOK,eol], length 0
        0x0000:  6006 0e00 002c 0640 0000 0000 0000 0000  `....,.@........
        0x0010:  0000 0000 0000 0001 0000 0000 0000 0000  ................
        0x0020:  0000 0000 0000 0001 f781 c383 e7ae 3df9  ..............=.
        0x0030:  0000 0000 b002 ffff 0034 0000 0204 3fc4  .........4....?.
        0x0040:  0103 0306 0101 080a d8e2 cc00 0000 0000  ................
        0x0050:  0402 0000                                ....
23:32:42.238161 IP6 (flowlabel 0x60e00, hlim 64, next-header TCP (6) payload length: 20) ::1.50051 > ::1.63361: Flags [R.], cksum 0x001c (incorrect -> 0xcf20), seq 0, ack 3886956026, win 0, length 0
        0x0000:  6006 0e00 0014 0640 0000 0000 0000 0000  `......@........
        0x0010:  0000 0000 0000 0001 0000 0000 0000 0000  ................
        0x0020:  0000 0000 0000 0001 c383 f781 0000 0000  ................
        0x0030:  e7ae 3dfa 5014 0000 001c 0000            ..=.P.......
23:32:42.239119 IP (tos 0x0, ttl 64, id 0, offset 0, flags [DF], proto TCP (6), length 64, bad cksum 0 (->3cb6)!)
    127.0.0.1.63362 > 127.0.0.1.50051: Flags [S], cksum 0xfe34 (incorrect -> 0x47bb), seq 2066212787, win 65535, options [mss 16344,nop,wscale 6,nop,nop,TS val 1640707949 ecr 0,sackOK,eol], length 0
        0x0000:  4500 0040 0000 4000 4006 0000 7f00 0001  E..@..@.@.......
        0x0010:  7f00 0001 f782 c383 7b27 e7b3 0000 0000  ........{'......
        0x0020:  b002 ffff fe34 0000 0204 3fd8 0103 0306  .....4....?.....
        0x0030:  0101 080a 61cb 376d 0000 0000 0402 0000  ....a.7m........
23:32:42.239256 IP (tos 0x0, ttl 64, id 0, offset 0, flags [DF], proto TCP (6), length 64, bad cksum 0 (->3cb6)!)
    127.0.0.1.50051 > 127.0.0.1.63362: Flags [S.], cksum 0xfe34 (incorrect -> 0x1f96), seq 1812827566, ack 2066212788, win 65535, options [mss 16344,nop,wscale 6,nop,nop,TS val 130688654 ecr 1640707949,sackOK,eol], length 0
        0x0000:  4500 0040 0000 4000 4006 0000 7f00 0001  E..@..@.@.......
        0x0010:  7f00 0001 c383 f782 6c0d 8dae 7b27 e7b4  ........l...{'..
        0x0020:  b012 ffff fe34 0000 0204 3fd8 0103 0306  .....4....?.....
        0x0030:  0101 080a 07ca 268e 61cb 376d 0402 0000  ......&.a.7m....
23:32:42.239296 IP (tos 0x0, ttl 64, id 0, offset 0, flags [DF], proto TCP (6), length 52, bad cksum 0 (->3cc2)!)
    127.0.0.1.63362 > 127.0.0.1.50051: Flags [.], cksum 0xfe28 (incorrect -> 0x809e), seq 1, ack 1, win 6380, options [nop,nop,TS val 1640707949 ecr 130688654], length 0
        0x0000:  4500 0034 0000 4000 4006 0000 7f00 0001  E..4..@.@.......
        0x0010:  7f00 0001 f782 c383 7b27 e7b4 6c0d 8daf  ........{'..l...
        0x0020:  8010 18ec fe28 0000 0101 080a 61cb 376d  .....(......a.7m
        0x0030:  07ca 268e                                ..&.
23:32:42.239323 IP (tos 0x0, ttl 64, id 0, offset 0, flags [DF], proto TCP (6), length 52, bad cksum 0 (->3cc2)!)
    127.0.0.1.50051 > 127.0.0.1.63362: Flags [.], cksum 0xfe28 (incorrect -> 0x809e), seq 1, ack 1, win 6380, options [nop,nop,TS val 130688654 ecr 1640707949], length 0
        0x0000:  4500 0034 0000 4000 4006 0000 7f00 0001  E..4..@.@.......
        0x0010:  7f00 0001 c383 f782 6c0d 8daf 7b27 e7b4  ........l...{'..
        0x0020:  8010 18ec fe28 0000 0101 080a 07ca 268e  .....(........&.
        0x0030:  61cb 376d                                a.7m
23:32:42.239860 IP (tos 0x0, ttl 64, id 0, offset 0, flags [DF], proto TCP (6), length 61, bad cksum 0 (->3cb9)!)
    127.0.0.1.50051 > 127.0.0.1.63362: Flags [P.], cksum 0xfe31 (incorrect -> 0x8089), seq 1:10, ack 1, win 6380, options [nop,nop,TS val 130688654 ecr 1640707949], length 9
        0x0000:  4500 003d 0000 4000 4006 0000 7f00 0001  E..=..@.@.......
        0x0010:  7f00 0001 c383 f782 6c0d 8daf 7b27 e7b4  ........l...{'..
        0x0020:  8018 18ec fe31 0000 0101 080a 07ca 268e  .....1........&.
        0x0030:  61cb 376d 0000 0004 0000 0000 00         a.7m.........
23:32:42.239903 IP (tos 0x0, ttl 64, id 0, offset 0, flags [DF], proto TCP (6), length 52, bad cksum 0 (->3cc2)!)
    127.0.0.1.63362 > 127.0.0.1.50051: Flags [.], cksum 0xfe28 (incorrect -> 0x8095), seq 1, ack 10, win 6380, options [nop,nop,TS val 1640707949 ecr 130688654], length 0
        0x0000:  4500 0034 0000 4000 4006 0000 7f00 0001  E..4..@.@.......
        0x0010:  7f00 0001 f782 c383 7b27 e7b4 6c0d 8db8  ........{'..l...
        0x0020:  8010 18ec fe28 0000 0101 080a 61cb 376d  .....(......a.7m
        0x0030:  07ca 268e                                ..&.
23:32:42.240362 IP (tos 0x0, ttl 64, id 0, offset 0, flags [DF], proto TCP (6), length 85, bad cksum 0 (->3ca1)!)
    127.0.0.1.63362 > 127.0.0.1.50051: Flags [P.], cksum 0xfe49 (incorrect -> 0x3b58), seq 1:34, ack 10, win 6380, options [nop,nop,TS val 1640707950 ecr 130688654], length 33
        0x0000:  4500 0055 0000 4000 4006 0000 7f00 0001  E..U..@.@.......
        0x0010:  7f00 0001 f782 c383 7b27 e7b4 6c0d 8db8  ........{'..l...
        0x0020:  8018 18ec fe49 0000 0101 080a 61cb 376e  .....I......a.7n
        0x0030:  07ca 268e 5052 4920 2a20 4854 5450 2f32  ..&.PRI.*.HTTP/2
        0x0040:  2e30 0d0a 0d0a 534d 0d0a 0d0a 0000 0004  .0....SM........
        0x0050:  0000 0000 00                             .....
23:32:42.240431 IP (tos 0x0, ttl 64, id 0, offset 0, flags [DF], proto TCP (6), length 52, bad cksum 0 (->3cc2)!)
    127.0.0.1.50051 > 127.0.0.1.63362: Flags [.], cksum 0xfe28 (incorrect -> 0x8072), seq 10, ack 34, win 6380, options [nop,nop,TS val 130688655 ecr 1640707950], length 0
        0x0000:  4500 0034 0000 4000 4006 0000 7f00 0001  E..4..@.@.......
        0x0010:  7f00 0001 c383 f782 6c0d 8db8 7b27 e7d5  ........l...{'..
        0x0020:  8010 18ec fe28 0000 0101 080a 07ca 268f  .....(........&.
        0x0030:  61cb 376e                                a.7n
23:32:42.240459 IP (tos 0x0, ttl 64, id 0, offset 0, flags [DF], proto TCP (6), length 61, bad cksum 0 (->3cb9)!)
    127.0.0.1.50051 > 127.0.0.1.63362: Flags [P.], cksum 0xfe31 (incorrect -> 0x7f5d), seq 10:19, ack 34, win 6380, options [nop,nop,TS val 130688655 ecr 1640707950], length 9
        0x0000:  4500 003d 0000 4000 4006 0000 7f00 0001  E..=..@.@.......
        0x0010:  7f00 0001 c383 f782 6c0d 8db8 7b27 e7d5  ........l...{'..
        0x0020:  8018 18ec fe31 0000 0101 080a 07ca 268f  .....1........&.
        0x0030:  61cb 376e 0000 0004 0100 0000 00         a.7n.........
23:32:42.240479 IP (tos 0x0, ttl 64, id 0, offset 0, flags [DF], proto TCP (6), length 52, bad cksum 0 (->3cc2)!)
    127.0.0.1.63362 > 127.0.0.1.50051: Flags [.], cksum 0xfe28 (incorrect -> 0x8069), seq 34, ack 19, win 6380, options [nop,nop,TS val 1640707950 ecr 130688655], length 0
        0x0000:  4500 0034 0000 4000 4006 0000 7f00 0001  E..4..@.@.......
        0x0010:  7f00 0001 f782 c383 7b27 e7d5 6c0d 8dc1  ........{'..l...
        0x0020:  8010 18ec fe28 0000 0101 080a 61cb 376e  .....(......a.7n
        0x0030:  07ca 268f                                ..&.
23:32:42.242601 IP (tos 0x0, ttl 64, id 0, offset 0, flags [DF], proto TCP (6), length 200, bad cksum 0 (->3c2e)!)
    127.0.0.1.63362 > 127.0.0.1.50051: Flags [P.], cksum 0xfebc (incorrect -> 0xffe9), seq 34:182, ack 19, win 6380, options [nop,nop,TS val 1640707953 ecr 130688655], length 148
        0x0000:  4500 00c8 0000 4000 4006 0000 7f00 0001  E.....@.@.......
        0x0010:  7f00 0001 f782 c383 7b27 e7d5 6c0d 8dc1  ........{'..l...
        0x0020:  8018 18ec febc 0000 0101 080a 61cb 3771  ............a.7q
        0x0030:  07ca 268f 0000 0004 0100 0000 0000 0074  ..&............t
        0x0040:  0104 0000 0001 418b a0e4 1d13 9d09 b8d8  ......A.........
        0x0050:  00d8 7f83 0492 6125 4257 dc9b 0a3a 4b63  ......a%BW...:Kc
        0x0060:  1b93 6147 4df1 a47f 8640 8e9a cac8 b0c8  ..aGM....@......
        0x0070:  42d6 958b 510f 21aa 9b90 3485 a926 4faf  B...Q.!...4..&O.
        0x0080:  a90b 2d03 497e a6f6 6aff 5086 3485 a926  ..-.I~..j.P.4..&
        0x0090:  4faf 7a8e 9aca c8b5 4790 ab74 4301 5c2c  O.z.....G..tC.\,
        0x00a0:  aed7 5f8b 1d75 d062 0d26 3d4c 4d65 6440  .._..u.b.&=LMed@
        0x00b0:  0274 6586 4d83 3505 b11f 0000 0500 0000  .te.M.5.........
        0x00c0:  0000 0100 0000 0000                      ........
23:32:42.242676 IP (tos 0x0, ttl 64, id 0, offset 0, flags [DF], proto TCP (6), length 52, bad cksum 0 (->3cc2)!)
    127.0.0.1.50051 > 127.0.0.1.63362: Flags [.], cksum 0xfe28 (incorrect -> 0x7fd1), seq 19, ack 182, win 6378, options [nop,nop,TS val 130688658 ecr 1640707953], length 0
        0x0000:  4500 0034 0000 4000 4006 0000 7f00 0001  E..4..@.@.......
        0x0010:  7f00 0001 c383 f782 6c0d 8dc1 7b27 e869  ........l...{'.i
        0x0020:  8010 18ea fe28 0000 0101 080a 07ca 2692  .....(........&.
        0x0030:  61cb 3771                                a.7q
23:32:42.243160 IP (tos 0x0, ttl 64, id 0, offset 0, flags [DF], proto TCP (6), length 61, bad cksum 0 (->3cb9)!)
    127.0.0.1.63362 > 127.0.0.1.50051: Flags [P.], cksum 0xfe31 (incorrect -> 0x7dbe), seq 182:191, ack 19, win 6380, options [nop,nop,TS val 1640707953 ecr 130688658], length 9
        0x0000:  4500 003d 0000 4000 4006 0000 7f00 0001  E..=..@.@.......
        0x0010:  7f00 0001 f782 c383 7b27 e869 6c0d 8dc1  ........{'.il...
        0x0020:  8018 18ec fe31 0000 0101 080a 61cb 3771  .....1......a.7q
        0x0030:  07ca 2692 0000 0000 0100 0000 01         ..&..........
23:32:42.243204 IP (tos 0x0, ttl 64, id 0, offset 0, flags [DF], proto TCP (6), length 52, bad cksum 0 (->3cc2)!)
    127.0.0.1.50051 > 127.0.0.1.63362: Flags [.], cksum 0xfe28 (incorrect -> 0x7fc8), seq 19, ack 191, win 6378, options [nop,nop,TS val 130688658 ecr 1640707953], length 0
        0x0000:  4500 0034 0000 4000 4006 0000 7f00 0001  E..4..@.@.......
        0x0010:  7f00 0001 c383 f782 6c0d 8dc1 7b27 e872  ........l...{'.r
        0x0020:  8010 18ea fe28 0000 0101 080a 07ca 2692  .....(........&.
        0x0030:  61cb 3771                                a.7q
23:32:42.347000 IP (tos 0x0, ttl 64, id 0, offset 0, flags [DF], proto TCP (6), length 173, bad cksum 0 (->3c49)!)
    127.0.0.1.50051 > 127.0.0.1.63362: Flags [P.], cksum 0xfea1 (incorrect -> 0x370f), seq 19:140, ack 191, win 6378, options [nop,nop,TS val 130688762 ecr 1640707953], length 121
        0x0000:  4500 00ad 0000 4000 4006 0000 7f00 0001  E.....@.@.......
        0x0010:  7f00 0001 c383 f782 6c0d 8dc1 7b27 e872  ........l...{'.r
        0x0020:  8018 18ea fea1 0000 0101 080a 07ca 26fa  ..............&.
        0x0030:  61cb 3771 0000 5f01 0400 0000 0188 5f90  a.7q.._......._.
        0x0040:  1d75 d062 0d26 3d4c 4d65 64ff 75d8 749f  .u.b.&=LMed.u.t.
        0x0050:  408e 9aca c8b0 c842 d695 8b51 0f21 aa9b  @......B...Q.!..
        0x0060:  9034 85a9 264f afa9 0b2d 0349 7ea6 f66a  .4..&O...-.I~..j
        0x0070:  ff40 8a9a cac8 b16a 21e4 3553 7f86 3485  .@.....j!.5S..4.
        0x0080:  a926 4faf 6196 d07a be94 03ea 65b6 a504  .&O.a..z....e...
        0x0090:  0136 a083 7191 5c68 4a62 d1bf 0000 0800  .6..q.\hJb......
        0x00a0:  0000 0000 0100 0000 0003 08f5 10         .............
23:32:42.347070 IP (tos 0x0, ttl 64, id 0, offset 0, flags [DF], proto TCP (6), length 52, bad cksum 0 (->3cc2)!)
    127.0.0.1.63362 > 127.0.0.1.50051: Flags [.], cksum 0xfe28 (incorrect -> 0x7e7e), seq 191, ack 140, win 6379, options [nop,nop,TS val 1640708057 ecr 130688762], length 0
        0x0000:  4500 0034 0000 4000 4006 0000 7f00 0001  E..4..@.@.......
        0x0010:  7f00 0001 f782 c383 7b27 e872 6c0d 8e3a  ........{'.rl..:
        0x0020:  8010 18eb fe28 0000 0101 080a 61cb 37d9  .....(......a.7.
        0x0030:  07ca 26fa                                ..&.
23:32:42.447666 IP (tos 0x0, ttl 64, id 0, offset 0, flags [DF], proto TCP (6), length 69, bad cksum 0 (->3cb1)!)
    127.0.0.1.50051 > 127.0.0.1.63362: Flags [P.], cksum 0xfe39 (incorrect -> 0x3010), seq 140:157, ack 191, win 6378, options [nop,nop,TS val 130688863 ecr 1640708057], length 17
        0x0000:  4500 0045 0000 4000 4006 0000 7f00 0001  E..E..@.@.......
        0x0010:  7f00 0001 c383 f782 6c0d 8e3a 7b27 e872  ........l..:{'.r
        0x0020:  8018 18ea fe39 0000 0101 080a 07ca 275f  .....9........'_
        0x0030:  61cb 37d9 0000 0800 0000 0000 0100 0000  a.7.............
        0x0040:  0003 08ee 3c                             ....<
23:32:42.447753 IP (tos 0x0, ttl 64, id 0, offset 0, flags [DF], proto TCP (6), length 52, bad cksum 0 (->3cc2)!)
    127.0.0.1.63362 > 127.0.0.1.50051: Flags [.], cksum 0xfe28 (incorrect -> 0x7da3), seq 191, ack 157, win 6379, options [nop,nop,TS val 1640708158 ecr 130688863], length 0
        0x0000:  4500 0034 0000 4000 4006 0000 7f00 0001  E..4..@.@.......
        0x0010:  7f00 0001 f782 c383 7b27 e872 6c0d 8e4b  ........{'.rl..K
        0x0020:  8010 18eb fe28 0000 0101 080a 61cb 383e  .....(......a.8>
        0x0030:  07ca 275f                                ..'_
23:32:42.549152 IP (tos 0x0, ttl 64, id 0, offset 0, flags [DF], proto TCP (6), length 69, bad cksum 0 (->3cb1)!)
    127.0.0.1.50051 > 127.0.0.1.63362: Flags [P.], cksum 0xfe39 (incorrect -> 0x6a79), seq 157:174, ack 191, win 6378, options [nop,nop,TS val 130688964 ecr 1640708158], length 17
        0x0000:  4500 0045 0000 4000 4006 0000 7f00 0001  E..E..@.@.......
        0x0010:  7f00 0001 c383 f782 6c0d 8e4b 7b27 e872  ........l..K{'.r
        0x0020:  8018 18ea fe39 0000 0101 080a 07ca 27c4  .....9........'.
        0x0030:  61cb 383e 0000 0800 0000 0000 0100 0000  a.8>............
        0x0040:  0003 08aa 01                             .....
23:32:42.549232 IP (tos 0x0, ttl 64, id 0, offset 0, flags [DF], proto TCP (6), length 52, bad cksum 0 (->3cc2)!)
    127.0.0.1.63362 > 127.0.0.1.50051: Flags [.], cksum 0xfe28 (incorrect -> 0x7cc8), seq 191, ack 174, win 6379, options [nop,nop,TS val 1640708259 ecr 130688964], length 0
        0x0000:  4500 0034 0000 4000 4006 0000 7f00 0001  E..4..@.@.......
        0x0010:  7f00 0001 f782 c383 7b27 e872 6c0d 8e5c  ........{'.rl..\
        0x0020:  8010 18eb fe28 0000 0101 080a 61cb 38a3  .....(......a.8.
        0x0030:  07ca 27c4                                ..'.
23:32:42.650036 IP (tos 0x0, ttl 64, id 0, offset 0, flags [DF], proto TCP (6), length 69, bad cksum 0 (->3cb1)!)
    127.0.0.1.50051 > 127.0.0.1.63362: Flags [P.], cksum 0xfe39 (incorrect -> 0x2f64), seq 174:191, ack 191, win 6378, options [nop,nop,TS val 130689065 ecr 1640708259], length 17
        0x0000:  4500 0045 0000 4000 4006 0000 7f00 0001  E..E..@.@.......
        0x0010:  7f00 0001 c383 f782 6c0d 8e5c 7b27 e872  ........l..\{'.r
        0x0020:  8018 18ea fe39 0000 0101 080a 07ca 2829  .....9........()
        0x0030:  61cb 38a3 0000 0800 0000 0000 0100 0000  a.8.............
        0x0040:  0003 08e4 3b                             ....;
23:32:42.650091 IP (tos 0x0, ttl 64, id 0, offset 0, flags [DF], proto TCP (6), length 52, bad cksum 0 (->3cc2)!)
    127.0.0.1.63362 > 127.0.0.1.50051: Flags [.], cksum 0xfe28 (incorrect -> 0x7bed), seq 191, ack 191, win 6379, options [nop,nop,TS val 1640708360 ecr 130689065], length 0
        0x0000:  4500 0034 0000 4000 4006 0000 7f00 0001  E..4..@.@.......
        0x0010:  7f00 0001 f782 c383 7b27 e872 6c0d 8e6d  ........{'.rl..m
        0x0020:  8010 18eb fe28 0000 0101 080a 61cb 3908  .....(......a.9.
        0x0030:  07ca 2829                                ..()
23:32:42.751728 IP (tos 0x0, ttl 64, id 0, offset 0, flags [DF], proto TCP (6), length 69, bad cksum 0 (->3cb1)!)
    127.0.0.1.50051 > 127.0.0.1.63362: Flags [P.], cksum 0xfe39 (incorrect -> 0x24a3), seq 191:208, ack 191, win 6378, options [nop,nop,TS val 130689167 ecr 1640708360], length 17
        0x0000:  4500 0045 0000 4000 4006 0000 7f00 0001  E..E..@.@.......
        0x0010:  7f00 0001 c383 f782 6c0d 8e6d 7b27 e872  ........l..m{'.r
        0x0020:  8018 18ea fe39 0000 0101 080a 07ca 288f  .....9........(.
        0x0030:  61cb 3908 0000 0800 0000 0000 0100 0000  a.9.............
        0x0040:  0003 08c9 45                             ....E
23:32:42.751818 IP (tos 0x0, ttl 64, id 0, offset 0, flags [DF], proto TCP (6), length 52, bad cksum 0 (->3cc2)!)
    127.0.0.1.63362 > 127.0.0.1.50051: Flags [.], cksum 0xfe28 (incorrect -> 0x7b10), seq 191, ack 208, win 6379, options [nop,nop,TS val 1640708462 ecr 130689167], length 0
        0x0000:  4500 0034 0000 4000 4006 0000 7f00 0001  E..4..@.@.......
        0x0010:  7f00 0001 f782 c383 7b27 e872 6c0d 8e7e  ........{'.rl..~
        0x0020:  8010 18eb fe28 0000 0101 080a 61cb 396e  .....(......a.9n
        0x0030:  07ca 288f                                ..(.
23:32:42.852556 IP (tos 0x0, ttl 64, id 0, offset 0, flags [DF], proto TCP (6), length 69, bad cksum 0 (->3cb1)!)
    127.0.0.1.50051 > 127.0.0.1.63362: Flags [P.], cksum 0xfe39 (incorrect -> 0x37f1), seq 208:225, ack 191, win 6378, options [nop,nop,TS val 130689268 ecr 1640708462], length 17
        0x0000:  4500 0045 0000 4000 4006 0000 7f00 0001  E..E..@.@.......
        0x0010:  7f00 0001 c383 f782 6c0d 8e7e 7b27 e872  ........l..~{'.r
        0x0020:  8018 18ea fe39 0000 0101 080a 07ca 28f4  .....9........(.
        0x0030:  61cb 396e 0000 0800 0000 0000 0100 0000  a.9n............
        0x0040:  0003 089f 31                             ....1
23:32:42.852610 IP (tos 0x0, ttl 64, id 0, offset 0, flags [DF], proto TCP (6), length 52, bad cksum 0 (->3cc2)!)
    127.0.0.1.63362 > 127.0.0.1.50051: Flags [.], cksum 0xfe28 (incorrect -> 0x7a35), seq 191, ack 225, win 6379, options [nop,nop,TS val 1640708563 ecr 130689268], length 0
        0x0000:  4500 0034 0000 4000 4006 0000 7f00 0001  E..4..@.@.......
        0x0010:  7f00 0001 f782 c383 7b27 e872 6c0d 8e8f  ........{'.rl...
        0x0020:  8010 18eb fe28 0000 0101 080a 61cb 39d3  .....(......a.9.
        0x0030:  07ca 28f4                                ..(.
23:32:42.953120 IP (tos 0x0, ttl 64, id 0, offset 0, flags [DF], proto TCP (6), length 69, bad cksum 0 (->3cb1)!)
    127.0.0.1.50051 > 127.0.0.1.63362: Flags [P.], cksum 0xfe39 (incorrect -> 0x4828), seq 225:242, ack 191, win 6378, options [nop,nop,TS val 130689368 ecr 1640708563], length 17
        0x0000:  4500 0045 0000 4000 4006 0000 7f00 0001  E..E..@.@.......
        0x0010:  7f00 0001 c383 f782 6c0d 8e8f 7b27 e872  ........l...{'.r
        0x0020:  8018 18ea fe39 0000 0101 080a 07ca 2958  .....9........)X
        0x0030:  61cb 39d3 0000 0800 0000 0000 0100 0000  a.9.............
        0x0040:  0003 088e 20                             .....
23:32:42.953199 IP (tos 0x0, ttl 64, id 0, offset 0, flags [DF], proto TCP (6), length 52, bad cksum 0 (->3cc2)!)
    127.0.0.1.63362 > 127.0.0.1.50051: Flags [.], cksum 0xfe28 (incorrect -> 0x795c), seq 191, ack 242, win 6379, options [nop,nop,TS val 1640708663 ecr 130689368], length 0
        0x0000:  4500 0034 0000 4000 4006 0000 7f00 0001  E..4..@.@.......
        0x0010:  7f00 0001 f782 c383 7b27 e872 6c0d 8ea0  ........{'.rl...
        0x0020:  8010 18eb fe28 0000 0101 080a 61cb 3a37  .....(......a.:7
        0x0030:  07ca 2958                                ..)X
23:32:43.053945 IP (tos 0x0, ttl 64, id 0, offset 0, flags [DF], proto TCP (6), length 69, bad cksum 0 (->3cb1)!)
    127.0.0.1.50051 > 127.0.0.1.63362: Flags [P.], cksum 0xfe39 (incorrect -> 0x631d), seq 242:259, ack 191, win 6378, options [nop,nop,TS val 130689469 ecr 1640708663], length 17
        0x0000:  4500 0045 0000 4000 4006 0000 7f00 0001  E..E..@.@.......
        0x0010:  7f00 0001 c383 f782 6c0d 8ea0 7b27 e872  ........l...{'.r
        0x0020:  8018 18ea fe39 0000 0101 080a 07ca 29bd  .....9........).
        0x0030:  61cb 3a37 0000 0800 0000 0000 0100 0000  a.:7............
        0x0040:  0003 08bf 04                             .....
23:32:43.054031 IP (tos 0x0, ttl 64, id 0, offset 0, flags [DF], proto TCP (6), length 52, bad cksum 0 (->3cc2)!)
    127.0.0.1.63362 > 127.0.0.1.50051: Flags [.], cksum 0xfe28 (incorrect -> 0x7881), seq 191, ack 259, win 6379, options [nop,nop,TS val 1640708764 ecr 130689469], length 0
        0x0000:  4500 0034 0000 4000 4006 0000 7f00 0001  E..4..@.@.......
        0x0010:  7f00 0001 f782 c383 7b27 e872 6c0d 8eb1  ........{'.rl...
        0x0020:  8010 18eb fe28 0000 0101 080a 61cb 3a9c  .....(......a.:.
        0x0030:  07ca 29bd                                ..).
23:32:43.155148 IP (tos 0x0, ttl 64, id 0, offset 0, flags [DF], proto TCP (6), length 69, bad cksum 0 (->3cb1)!)
    127.0.0.1.50051 > 127.0.0.1.63362: Flags [P.], cksum 0xfe39 (incorrect -> 0x3614), seq 259:276, ack 191, win 6378, options [nop,nop,TS val 130689570 ecr 1640708764], length 17
        0x0000:  4500 0045 0000 4000 4006 0000 7f00 0001  E..E..@.@.......
        0x0010:  7f00 0001 c383 f782 6c0d 8eb1 7b27 e872  ........l...{'.r
        0x0020:  8018 18ea fe39 0000 0101 080a 07ca 2a22  .....9........*"
        0x0030:  61cb 3a9c 0000 0800 0000 0000 0100 0000  a.:.............
        0x0040:  0003 08ed 30                             ....0
23:32:43.155233 IP (tos 0x0, ttl 64, id 0, offset 0, flags [DF], proto TCP (6), length 52, bad cksum 0 (->3cc2)!)
    127.0.0.1.63362 > 127.0.0.1.50051: Flags [.], cksum 0xfe28 (incorrect -> 0x77a6), seq 191, ack 276, win 6379, options [nop,nop,TS val 1640708865 ecr 130689570], length 0
        0x0000:  4500 0034 0000 4000 4006 0000 7f00 0001  E..4..@.@.......
        0x0010:  7f00 0001 f782 c383 7b27 e872 6c0d 8ec2  ........{'.rl...
        0x0020:  8010 18eb fe28 0000 0101 080a 61cb 3b01  .....(......a.;.
        0x0030:  07ca 2a22                                ..*"
23:32:43.238730 IP6 (flowlabel 0x40b00, hlim 64, next-header TCP (6) payload length: 44) ::1.63364 > ::1.50051: Flags [S], cksum 0x0034 (incorrect -> 0xbca1), seq 1728530274, win 65535, options [mss 16324,nop,wscale 6,nop,nop,TS val 248891393 ecr 0,sackOK,eol], length 0
        0x0000:  6004 0b00 002c 0640 0000 0000 0000 0000  `....,.@........
        0x0010:  0000 0000 0000 0001 0000 0000 0000 0000  ................
        0x0020:  0000 0000 0000 0001 f784 c383 6707 4762  ............g.Gb
        0x0030:  0000 0000 b002 ffff 0034 0000 0204 3fc4  .........4....?.
        0x0040:  0103 0306 0101 080a 0ed5 c801 0000 0000  ................
        0x0050:  0402 0000                                ....
23:32:43.238779 IP6 (flowlabel 0x40b00, hlim 64, next-header TCP (6) payload length: 20) ::1.50051 > ::1.63364: Flags [R.], cksum 0x001c (incorrect -> 0x465c), seq 0, ack 1728530275, win 0, length 0
        0x0000:  6004 0b00 0014 0640 0000 0000 0000 0000  `......@........
        0x0010:  0000 0000 0000 0001 0000 0000 0000 0000  ................
        0x0020:  0000 0000 0000 0001 c383 f784 0000 0000  ................
        0x0030:  6707 4763 5014 0000 001c 0000            g.GcP.......
23:32:43.255970 IP (tos 0x0, ttl 64, id 0, offset 0, flags [DF], proto TCP (6), length 69, bad cksum 0 (->3cb1)!)
    127.0.0.1.50051 > 127.0.0.1.63362: Flags [P.], cksum 0xfe39 (incorrect -> 0x3762), seq 276:293, ack 191, win 6378, options [nop,nop,TS val 130689671 ecr 1640708865], length 17
        0x0000:  4500 0045 0000 4000 4006 0000 7f00 0001  E..E..@.@.......
        0x0010:  7f00 0001 c383 f782 6c0d 8ec2 7b27 e872  ........l...{'.r
        0x0020:  8018 18ea fe39 0000 0101 080a 07ca 2a87  .....9........*.
        0x0030:  61cb 3b01 0000 0800 0000 0000 0100 0000  a.;.............
        0x0040:  0003 08c4 2e                             .....
23:32:43.256020 IP (tos 0x0, ttl 64, id 0, offset 0, flags [DF], proto TCP (6), length 52, bad cksum 0 (->3cc2)!)
    127.0.0.1.63362 > 127.0.0.1.50051: Flags [.], cksum 0xfe28 (incorrect -> 0x76cb), seq 191, ack 293, win 6379, options [nop,nop,TS val 1640708966 ecr 130689671], length 0
        0x0000:  4500 0034 0000 4000 4006 0000 7f00 0001  E..4..@.@.......
        0x0010:  7f00 0001 f782 c383 7b27 e872 6c0d 8ed3  ........{'.rl...
        0x0020:  8010 18eb fe28 0000 0101 080a 61cb 3b66  .....(......a.;f
        0x0030:  07ca 2a87                                ..*.
23:32:43.357322 IP (tos 0x0, ttl 64, id 0, offset 0, flags [DF], proto TCP (6), length 69, bad cksum 0 (->3cb1)!)
    127.0.0.1.50051 > 127.0.0.1.63362: Flags [P.], cksum 0xfe39 (incorrect -> 0x2e57), seq 293:310, ack 191, win 6378, options [nop,nop,TS val 130689772 ecr 1640708966], length 17
        0x0000:  4500 0045 0000 4000 4006 0000 7f00 0001  E..E..@.@.......
        0x0010:  7f00 0001 c383 f782 6c0d 8ed3 7b27 e872  ........l...{'.r
        0x0020:  8018 18ea fe39 0000 0101 080a 07ca 2aec  .....9........*.
        0x0030:  61cb 3b66 0000 0800 0000 0000 0100 0000  a.;f............
        0x0040:  0003 08f4 36                             ....6
23:32:43.357367 IP (tos 0x0, ttl 64, id 0, offset 0, flags [DF], proto TCP (6), length 52, bad cksum 0 (->3cc2)!)
    127.0.0.1.63362 > 127.0.0.1.50051: Flags [.], cksum 0xfe28 (incorrect -> 0x75f0), seq 191, ack 310, win 6379, options [nop,nop,TS val 1640709067 ecr 130689772], length 0
        0x0000:  4500 0034 0000 4000 4006 0000 7f00 0001  E..4..@.@.......
        0x0010:  7f00 0001 f782 c383 7b27 e872 6c0d 8ee4  ........{'.rl...
        0x0020:  8010 18eb fe28 0000 0101 080a 61cb 3bcb  .....(......a.;.
        0x0030:  07ca 2aec                                ..*.
23:32:43.398566 IP (tos 0x0, ttl 64, id 0, offset 0, flags [DF], proto TCP (6), length 52, bad cksum 0 (->3cc2)!)
    127.0.0.1.63362 > 127.0.0.1.50051: Flags [F.], cksum 0xfe28 (incorrect -> 0x75c5), seq 191, ack 310, win 6379, options [nop,nop,TS val 1640709109 ecr 130689772], length 0
        0x0000:  4500 0034 0000 4000 4006 0000 7f00 0001  E..4..@.@.......
        0x0010:  7f00 0001 f782 c383 7b27 e872 6c0d 8ee4  ........{'.rl...
        0x0020:  8011 18eb fe28 0000 0101 080a 61cb 3bf5  .....(......a.;.
        0x0030:  07ca 2aec                                ..*.
23:32:43.398642 IP (tos 0x0, ttl 64, id 0, offset 0, flags [DF], proto TCP (6), length 52, bad cksum 0 (->3cc2)!)
    127.0.0.1.50051 > 127.0.0.1.63362: Flags [.], cksum 0xfe28 (incorrect -> 0x759c), seq 310, ack 192, win 6378, options [nop,nop,TS val 130689814 ecr 1640709109], length 0
        0x0000:  4500 0034 0000 4000 4006 0000 7f00 0001  E..4..@.@.......
        0x0010:  7f00 0001 c383 f782 6c0d 8ee4 7b27 e873  ........l...{'.s
        0x0020:  8010 18ea fe28 0000 0101 080a 07ca 2b16  .....(........+.
        0x0030:  61cb 3bf5                                a.;.
23:32:43.398769 IP (tos 0x0, ttl 64, id 0, offset 0, flags [DF], proto TCP (6), length 52, bad cksum 0 (->3cc2)!)
    127.0.0.1.50051 > 127.0.0.1.63362: Flags [F.], cksum 0xfe28 (incorrect -> 0x759b), seq 310, ack 192, win 6378, options [nop,nop,TS val 130689814 ecr 1640709109], length 0
        0x0000:  4500 0034 0000 4000 4006 0000 7f00 0001  E..4..@.@.......
        0x0010:  7f00 0001 c383 f782 6c0d 8ee4 7b27 e873  ........l...{'.s
        0x0020:  8011 18ea fe28 0000 0101 080a 07ca 2b16  .....(........+.
        0x0030:  61cb 3bf5                                a.;.
23:32:43.398865 IP (tos 0x0, ttl 64, id 0, offset 0, flags [DF], proto TCP (6), length 52, bad cksum 0 (->3cc2)!)
    127.0.0.1.63362 > 127.0.0.1.50051: Flags [.], cksum 0xfe28 (incorrect -> 0x759a), seq 192, ack 311, win 6379, options [nop,nop,TS val 1640709109 ecr 130689814], length 0
        0x0000:  4500 0034 0000 4000 4006 0000 7f00 0001  E..4..@.@.......
        0x0010:  7f00 0001 f782 c383 7b27 e873 6c0d 8ee5  ........{'.sl...
        0x0020:  8010 18eb fe28 0000 0101 080a 61cb 3bf5  .....(......a.;.
        0x0030:  07ca 2b16                                ..+.
```
</details>

<details>
<summary>bun run client.ts</summary>

```
23:32:59.394950 IP6 (flowlabel 0x10400, hlim 64, next-header TCP (6) payload length: 44) ::1.63368 > ::1.50051: Flags [S], cksum 0x0034 (incorrect -> 0xdc6b), seq 2978704309, win 65535, options [mss 16324,nop,wscale 6,nop,nop,TS val 3204942121 ecr 0,sackOK,eol], length 0
        0x0000:  6001 0400 002c 0640 0000 0000 0000 0000  `....,.@........
        0x0010:  0000 0000 0000 0001 0000 0000 0000 0000  ................
        0x0020:  0000 0000 0000 0001 f788 c383 b18b 6bb5  ..............k.
        0x0030:  0000 0000 b002 ffff 0034 0000 0204 3fc4  .........4....?.
        0x0040:  0103 0306 0101 080a bf07 8929 0000 0000  ...........)....
        0x0050:  0402 0000                                ....
23:32:59.394994 IP6 (flowlabel 0x10400, hlim 64, next-header TCP (6) payload length: 20) ::1.50051 > ::1.63368: Flags [R.], cksum 0x001c (incorrect -> 0xd780), seq 0, ack 2978704310, win 0, length 0
        0x0000:  6001 0400 0014 0640 0000 0000 0000 0000  `......@........
        0x0010:  0000 0000 0000 0001 0000 0000 0000 0000  ................
        0x0020:  0000 0000 0000 0001 c383 f788 0000 0000  ................
        0x0030:  b18b 6bb6 5014 0000 001c 0000            ..k.P.......
23:32:59.397592 IP (tos 0x0, ttl 64, id 0, offset 0, flags [DF], proto TCP (6), length 64, bad cksum 0 (->3cb6)!)
    127.0.0.1.63369 > 127.0.0.1.50051: Flags [S], cksum 0xfe34 (incorrect -> 0xf6c1), seq 821834903, win 65535, options [mss 16344,nop,wscale 6,nop,nop,TS val 4044879450 ecr 0,sackOK,eol], length 0
        0x0000:  4500 0040 0000 4000 4006 0000 7f00 0001  E..@..@.@.......
        0x0010:  7f00 0001 f789 c383 30fc 3497 0000 0000  ........0.4.....
        0x0020:  b002 ffff fe34 0000 0204 3fd8 0103 0306  .....4....?.....
        0x0030:  0101 080a f117 f65a 0000 0000 0402 0000  .......Z........
23:32:59.397676 IP (tos 0x0, ttl 64, id 0, offset 0, flags [DF], proto TCP (6), length 64, bad cksum 0 (->3cb6)!)
    127.0.0.1.50051 > 127.0.0.1.63369: Flags [S.], cksum 0xfe34 (incorrect -> 0x7e09), seq 843893170, ack 821834904, win 65535, options [mss 16344,nop,wscale 6,nop,nop,TS val 1908607717 ecr 4044879450,sackOK,eol], length 0
        0x0000:  4500 0040 0000 4000 4006 0000 7f00 0001  E..@..@.@.......
        0x0010:  7f00 0001 c383 f789 324c c9b2 30fc 3498  ........2L..0.4.
        0x0020:  b012 ffff fe34 0000 0204 3fd8 0103 0306  .....4....?.....
        0x0030:  0101 080a 71c3 0ae5 f117 f65a 0402 0000  ....q......Z....
23:32:59.397703 IP (tos 0x0, ttl 64, id 0, offset 0, flags [DF], proto TCP (6), length 52, bad cksum 0 (->3cc2)!)
    127.0.0.1.63369 > 127.0.0.1.50051: Flags [.], cksum 0xfe28 (incorrect -> 0xdf11), seq 1, ack 1, win 6380, options [nop,nop,TS val 4044879450 ecr 1908607717], length 0
        0x0000:  4500 0034 0000 4000 4006 0000 7f00 0001  E..4..@.@.......
        0x0010:  7f00 0001 f789 c383 30fc 3498 324c c9b3  ........0.4.2L..
        0x0020:  8010 18ec fe28 0000 0101 080a f117 f65a  .....(.........Z
        0x0030:  71c3 0ae5                                q...
23:32:59.397724 IP (tos 0x0, ttl 64, id 0, offset 0, flags [DF], proto TCP (6), length 52, bad cksum 0 (->3cc2)!)
    127.0.0.1.50051 > 127.0.0.1.63369: Flags [.], cksum 0xfe28 (incorrect -> 0xdf11), seq 1, ack 1, win 6380, options [nop,nop,TS val 1908607717 ecr 4044879450], length 0
        0x0000:  4500 0034 0000 4000 4006 0000 7f00 0001  E..4..@.@.......
        0x0010:  7f00 0001 c383 f789 324c c9b3 30fc 3498  ........2L..0.4.
        0x0020:  8010 18ec fe28 0000 0101 080a 71c3 0ae5  .....(......q...
        0x0030:  f117 f65a                                ...Z
23:32:59.398393 IP (tos 0x0, ttl 64, id 0, offset 0, flags [DF], proto TCP (6), length 61, bad cksum 0 (->3cb9)!)
    127.0.0.1.50051 > 127.0.0.1.63369: Flags [P.], cksum 0xfe31 (incorrect -> 0xdefc), seq 1:10, ack 1, win 6380, options [nop,nop,TS val 1908607717 ecr 4044879450], length 9
        0x0000:  4500 003d 0000 4000 4006 0000 7f00 0001  E..=..@.@.......
        0x0010:  7f00 0001 c383 f789 324c c9b3 30fc 3498  ........2L..0.4.
        0x0020:  8018 18ec fe31 0000 0101 080a 71c3 0ae5  .....1......q...
        0x0030:  f117 f65a 0000 0004 0000 0000 00         ...Z.........
23:32:59.398428 IP (tos 0x0, ttl 64, id 0, offset 0, flags [DF], proto TCP (6), length 52, bad cksum 0 (->3cc2)!)
    127.0.0.1.63369 > 127.0.0.1.50051: Flags [.], cksum 0xfe28 (incorrect -> 0xdf08), seq 1, ack 10, win 6380, options [nop,nop,TS val 4044879450 ecr 1908607717], length 0
        0x0000:  4500 0034 0000 4000 4006 0000 7f00 0001  E..4..@.@.......
        0x0010:  7f00 0001 f789 c383 30fc 3498 324c c9bc  ........0.4.2L..
        0x0020:  8010 18ec fe28 0000 0101 080a f117 f65a  .....(.........Z
        0x0030:  71c3 0ae5                                q...
23:32:59.399375 IP (tos 0x0, ttl 64, id 0, offset 0, flags [DF], proto TCP (6), length 130, bad cksum 0 (->3c74)!)
    127.0.0.1.63369 > 127.0.0.1.50051: Flags [P.], cksum 0xfe76 (incorrect -> 0x5c4c), seq 1:79, ack 10, win 6380, options [nop,nop,TS val 4044879452 ecr 1908607717], length 78
        0x0000:  4500 0082 0000 4000 4006 0000 7f00 0001  E.....@.@.......
        0x0010:  7f00 0001 f789 c383 30fc 3498 324c c9bc  ........0.4.2L..
        0x0020:  8018 18ec fe76 0000 0101 080a f117 f65c  .....v.........\
        0x0030:  71c3 0ae5 5052 4920 2a20 4854 5450 2f32  q...PRI.*.HTTP/2
        0x0040:  2e30 0d0a 0d0a 534d 0d0a 0d0a 0000 2404  .0....SM......$.
        0x0050:  0000 0000 0000 0100 0010 0000 0200 0000  ................
        0x0060:  0000 03ff ffff ff00 0400 00ff ff00 0500  ................
        0x0070:  0040 0000 0600 00ff ff00 0000 0401 0000  .@..............
        0x0080:  0000                                     ..
23:32:59.399400 IP (tos 0x0, ttl 64, id 0, offset 0, flags [DF], proto TCP (6), length 52, bad cksum 0 (->3cc2)!)
    127.0.0.1.50051 > 127.0.0.1.63369: Flags [.], cksum 0xfe28 (incorrect -> 0xdeb7), seq 10, ack 79, win 6379, options [nop,nop,TS val 1908607719 ecr 4044879452], length 0
        0x0000:  4500 0034 0000 4000 4006 0000 7f00 0001  E..4..@.@.......
        0x0010:  7f00 0001 c383 f789 324c c9bc 30fc 34e6  ........2L..0.4.
        0x0020:  8010 18eb fe28 0000 0101 080a 71c3 0ae7  .....(......q...
        0x0030:  f117 f65c                                ...\
23:32:59.399441 IP (tos 0x0, ttl 64, id 0, offset 0, flags [DF], proto TCP (6), length 61, bad cksum 0 (->3cb9)!)
    127.0.0.1.50051 > 127.0.0.1.63369: Flags [P.], cksum 0xfe31 (incorrect -> 0xdda2), seq 10:19, ack 79, win 6379, options [nop,nop,TS val 1908607719 ecr 4044879452], length 9
        0x0000:  4500 003d 0000 4000 4006 0000 7f00 0001  E..=..@.@.......
        0x0010:  7f00 0001 c383 f789 324c c9bc 30fc 34e6  ........2L..0.4.
        0x0020:  8018 18eb fe31 0000 0101 080a 71c3 0ae7  .....1......q...
        0x0030:  f117 f65c 0000 0004 0100 0000 00         ...\.........
23:32:59.399465 IP (tos 0x0, ttl 64, id 0, offset 0, flags [DF], proto TCP (6), length 52, bad cksum 0 (->3cc2)!)
    127.0.0.1.63369 > 127.0.0.1.50051: Flags [.], cksum 0xfe28 (incorrect -> 0xdead), seq 79, ack 19, win 6380, options [nop,nop,TS val 4044879452 ecr 1908607719], length 0
        0x0000:  4500 0034 0000 4000 4006 0000 7f00 0001  E..4..@.@.......
        0x0010:  7f00 0001 f789 c383 30fc 34e6 324c c9c5  ........0.4.2L..
        0x0020:  8010 18ec fe28 0000 0101 080a f117 f65c  .....(.........\
        0x0030:  71c3 0ae7                                q...
23:33:00.394290 IP6 (flowlabel 0xb0000, hlim 64, next-header TCP (6) payload length: 44) ::1.63370 > ::1.50051: Flags [S], cksum 0x0034 (incorrect -> 0xf3a1), seq 3764531840, win 65535, options [mss 16324,nop,wscale 6,nop,nop,TS val 116995166 ecr 0,sackOK,eol], length 0
        0x0000:  600b 0000 002c 0640 0000 0000 0000 0000  `....,.@........
        0x0010:  0000 0000 0000 0001 0000 0000 0000 0000  ................
        0x0020:  0000 0000 0000 0001 f78a c383 e062 3280  .............b2.
        0x0030:  0000 0000 b002 ffff 0034 0000 0204 3fc4  .........4....?.
        0x0040:  0103 0306 0101 080a 06f9 345e 0000 0000  ..........4^....
        0x0050:  0402 0000                                ....
23:33:00.394362 IP6 (flowlabel 0xb0000, hlim 64, next-header TCP (6) payload length: 20) ::1.50051 > ::1.63370: Flags [R.], cksum 0x001c (incorrect -> 0xe1dc), seq 0, ack 3764531841, win 0, length 0
        0x0000:  600b 0000 0014 0640 0000 0000 0000 0000  `......@........
        0x0010:  0000 0000 0000 0001 0000 0000 0000 0000  ................
        0x0020:  0000 0000 0000 0001 c383 f78a 0000 0000  ................
        0x0030:  e062 3281 5014 0000 001c 0000            .b2.P.......
23:33:02.122425 IP6 (flowlabel 0xf0f00, hlim 64, next-header TCP (6) payload length: 44) ::1.63374 > ::1.50051: Flags [S], cksum 0x0034 (incorrect -> 0xd72c), seq 131828058, win 65535, options [mss 16324,nop,wscale 6,nop,nop,TS val 1894672519 ecr 0,sackOK,eol], length 0
        0x0000:  600f 0f00 002c 0640 0000 0000 0000 0000  `....,.@........
        0x0010:  0000 0000 0000 0001 0000 0000 0000 0000  ................
        0x0020:  0000 0000 0000 0001 f78e c383 07db 895a  ...............Z
        0x0030:  0000 0000 b002 ffff 0034 0000 0204 3fc4  .........4....?.
        0x0040:  0103 0306 0101 080a 70ee 6887 0000 0000  ........p.h.....
        0x0050:  0402 0000                                ....
23:33:02.122506 IP6 (flowlabel 0xf0f00, hlim 64, next-header TCP (6) payload length: 20) ::1.50051 > ::1.63374: Flags [R.], cksum 0x001c (incorrect -> 0x6386), seq 0, ack 131828059, win 0, length 0
        0x0000:  600f 0f00 0014 0640 0000 0000 0000 0000  `......@........
        0x0010:  0000 0000 0000 0001 0000 0000 0000 0000  ................
        0x0020:  0000 0000 0000 0001 c383 f78e 0000 0000  ................
        0x0030:  07db 895b 5014 0000 001c 0000            ...[P.......
23:33:04.684886 IP6 (flowlabel 0x20c00, hlim 64, next-header TCP (6) payload length: 44) ::1.63378 > ::1.50051: Flags [S], cksum 0x0034 (incorrect -> 0xd40d), seq 2439025406, win 65535, options [mss 16324,nop,wscale 6,nop,nop,TS val 1773264821 ecr 0,sackOK,eol], length 0
        0x0000:  6002 0c00 002c 0640 0000 0000 0000 0000  `....,.@........
        0x0010:  0000 0000 0000 0001 0000 0000 0000 0000  ................
        0x0020:  0000 0000 0000 0001 f792 c383 9160 92fe  .............`..
        0x0030:  0000 0000 b002 ffff 0034 0000 0204 3fc4  .........4....?.
        0x0040:  0103 0306 0101 080a 69b1 dfb5 0000 0000  ........i.......
        0x0050:  0402 0000                                ....
23:33:04.684977 IP6 (flowlabel 0x20c00, hlim 64, next-header TCP (6) payload length: 20) ::1.50051 > ::1.63378: Flags [R.], cksum 0x001c (incorrect -> 0xd058), seq 0, ack 2439025407, win 0, length 0
        0x0000:  6002 0c00 0014 0640 0000 0000 0000 0000  `......@........
        0x0010:  0000 0000 0000 0001 0000 0000 0000 0000  ................
        0x0020:  0000 0000 0000 0001 c383 f792 0000 0000  ................
        0x0030:  9160 92ff 5014 0000 001c 0000            .`..P.......
23:33:08.786732 IP6 (flowlabel 0x60300, hlim 64, next-header TCP (6) payload length: 44) ::1.63379 > ::1.50051: Flags [S], cksum 0x0034 (incorrect -> 0xb4ea), seq 3182800382, win 65535, options [mss 16324,nop,wscale 6,nop,nop,TS val 2556725455 ecr 0,sackOK,eol], length 0
        0x0000:  6006 0300 002c 0640 0000 0000 0000 0000  `....,.@........
        0x0010:  0000 0000 0000 0001 0000 0000 0000 0000  ................
        0x0020:  0000 0000 0000 0001 f793 c383 bdb5 adfe  ................
        0x0030:  0000 0000 b002 ffff 0034 0000 0204 3fc4  .........4....?.
        0x0040:  0103 0306 0101 080a 9864 88cf 0000 0000  .........d......
        0x0050:  0402 0000                                ....
23:33:08.786797 IP6 (flowlabel 0x60300, hlim 64, next-header TCP (6) payload length: 20) ::1.50051 > ::1.63379: Flags [R.], cksum 0x001c (incorrect -> 0x8902), seq 0, ack 3182800383, win 0, length 0
        0x0000:  6006 0300 0014 0640 0000 0000 0000 0000  `......@........
        0x0010:  0000 0000 0000 0001 0000 0000 0000 0000  ................
        0x0020:  0000 0000 0000 0001 c383 f793 0000 0000  ................
        0x0030:  bdb5 adff 5014 0000 001c 0000            ....P.......
23:33:09.400616 IP (tos 0x0, ttl 64, id 0, offset 0, flags [DF], proto TCP (6), length 69, bad cksum 0 (->3cb1)!)
    127.0.0.1.50051 > 127.0.0.1.63369: Flags [P.], cksum 0xfe39 (incorrect -> 0x26a1), seq 19:36, ack 79, win 6379, options [nop,nop,TS val 1908617719 ecr 4044879452], length 17
        0x0000:  4500 0045 0000 4000 4006 0000 7f00 0001  E..E..@.@.......
        0x0010:  7f00 0001 c383 f789 324c c9c5 30fc 34e6  ........2L..0.4.
        0x0020:  8018 18eb fe39 0000 0101 080a 71c3 31f7  .....9......q.1.
        0x0030:  f117 f65c 0000 0806 0000 0000 00e2 ec73  ...\...........s
        0x0040:  ac7d ef0a 00                             .}...
23:33:09.400713 IP (tos 0x0, ttl 64, id 0, offset 0, flags [DF], proto TCP (6), length 52, bad cksum 0 (->3cc2)!)
    127.0.0.1.63369 > 127.0.0.1.50051: Flags [.], cksum 0xfe28 (incorrect -> 0x907c), seq 79, ack 36, win 6380, options [nop,nop,TS val 4044889452 ecr 1908617719], length 0
        0x0000:  4500 0034 0000 4000 4006 0000 7f00 0001  E..4..@.@.......
        0x0010:  7f00 0001 f789 c383 30fc 34e6 324c c9d6  ........0.4.2L..
        0x0020:  8010 18ec fe28 0000 0101 080a f118 1d6c  .....(.........l
        0x0030:  71c3 31f7                                q.1.
23:33:09.401157 IP (tos 0x0, ttl 64, id 0, offset 0, flags [DF], proto TCP (6), length 69, bad cksum 0 (->3cb1)!)
    127.0.0.1.63369 > 127.0.0.1.50051: Flags [P.], cksum 0xfe39 (incorrect -> 0xfe7c), seq 79:96, ack 36, win 6380, options [nop,nop,TS val 4044889454 ecr 1908617719], length 17
        0x0000:  4500 0045 0000 4000 4006 0000 7f00 0001  E..E..@.@.......
        0x0010:  7f00 0001 f789 c383 30fc 34e6 324c c9d6  ........0.4.2L..
        0x0020:  8018 18ec fe39 0000 0101 080a f118 1d6e  .....9.........n
        0x0030:  71c3 31f7 0000 0806 0100 0000 00e2 ec73  q.1............s
        0x0040:  ac7d ef0a 00                             .}...
23:33:09.401207 IP (tos 0x0, ttl 64, id 0, offset 0, flags [DF], proto TCP (6), length 52, bad cksum 0 (->3cc2)!)
    127.0.0.1.50051 > 127.0.0.1.63369: Flags [.], cksum 0xfe28 (incorrect -> 0x9068), seq 36, ack 96, win 6379, options [nop,nop,TS val 1908617721 ecr 4044889454], length 0
        0x0000:  4500 0034 0000 4000 4006 0000 7f00 0001  E..4..@.@.......
        0x0010:  7f00 0001 c383 f789 324c c9d6 30fc 34f7  ........2L..0.4.
        0x0020:  8010 18eb fe28 0000 0101 080a 71c3 31f9  .....(......q.1.
        0x0030:  f118 1d6e                                ...n
23:33:15.342685 IP6 (flowlabel 0x00900, hlim 64, next-header TCP (6) payload length: 44) ::1.63383 > ::1.50051: Flags [S], cksum 0x0034 (incorrect -> 0x07e9), seq 2631563151, win 65535, options [mss 16324,nop,wscale 6,nop,nop,TS val 2806873646 ecr 0,sackOK,eol], length 0
        0x0000:  6000 0900 002c 0640 0000 0000 0000 0000  `....,.@........
        0x0010:  0000 0000 0000 0001 0000 0000 0000 0000  ................
        0x0020:  0000 0000 0000 0001 f797 c383 9cda 778f  ..............w.
        0x0030:  0000 0000 b002 ffff 0034 0000 0204 3fc4  .........4....?.
        0x0040:  0103 0306 0101 080a a74d 7e2e 0000 0000  .........M~.....
        0x0050:  0402 0000                                ....
23:33:15.342757 IP6 (flowlabel 0x00900, hlim 64, next-header TCP (6) payload length: 20) ::1.50051 > ::1.63383: Flags [R.], cksum 0x001c (incorrect -> 0xe048), seq 0, ack 2631563152, win 0, length 0
        0x0000:  6000 0900 0014 0640 0000 0000 0000 0000  `......@........
        0x0010:  0000 0000 0000 0001 0000 0000 0000 0000  ................
        0x0020:  0000 0000 0000 0001 c383 f797 0000 0000  ................
        0x0030:  9cda 7790 5014 0000 001c 0000            ..w.P.......
23:33:16.513736 IP (tos 0x0, ttl 64, id 0, offset 0, flags [DF], proto TCP (6), length 52, bad cksum 0 (->3cc2)!)
    127.0.0.1.63369 > 127.0.0.1.50051: Flags [F.], cksum 0xfe28 (incorrect -> 0x749e), seq 96, ack 36, win 6380, options [nop,nop,TS val 4044896566 ecr 1908617721], length 0
        0x0000:  4500 0034 0000 4000 4006 0000 7f00 0001  E..4..@.@.......
        0x0010:  7f00 0001 f789 c383 30fc 34f7 324c c9d6  ........0.4.2L..
        0x0020:  8011 18ec fe28 0000 0101 080a f118 3936  .....(........96
        0x0030:  71c3 31f9                                q.1.
23:33:16.513845 IP (tos 0x0, ttl 64, id 0, offset 0, flags [DF], proto TCP (6), length 52, bad cksum 0 (->3cc2)!)
    127.0.0.1.50051 > 127.0.0.1.63369: Flags [.], cksum 0xfe28 (incorrect -> 0x58d7), seq 36, ack 97, win 6379, options [nop,nop,TS val 1908624833 ecr 4044896566], length 0
        0x0000:  4500 0034 0000 4000 4006 0000 7f00 0001  E..4..@.@.......
        0x0010:  7f00 0001 c383 f789 324c c9d6 30fc 34f8  ........2L..0.4.
        0x0020:  8010 18eb fe28 0000 0101 080a 71c3 4dc1  .....(......q.M.
        0x0030:  f118 3936                                ..96
23:33:16.514140 IP (tos 0x0, ttl 64, id 0, offset 0, flags [DF], proto TCP (6), length 52, bad cksum 0 (->3cc2)!)
    127.0.0.1.50051 > 127.0.0.1.63369: Flags [F.], cksum 0xfe28 (incorrect -> 0x58d6), seq 36, ack 97, win 6379, options [nop,nop,TS val 1908624833 ecr 4044896566], length 0
        0x0000:  4500 0034 0000 4000 4006 0000 7f00 0001  E..4..@.@.......
        0x0010:  7f00 0001 c383 f789 324c c9d6 30fc 34f8  ........2L..0.4.
        0x0020:  8011 18eb fe28 0000 0101 080a 71c3 4dc1  .....(......q.M.
        0x0030:  f118 3936                                ..96
23:33:16.514273 IP (tos 0x0, ttl 64, id 0, offset 0, flags [DF], proto TCP (6), length 52, bad cksum 0 (->3cc2)!)
    127.0.0.1.63369 > 127.0.0.1.50051: Flags [.], cksum 0xfe28 (incorrect -> 0x58d5), seq 97, ack 37, win 6380, options [nop,nop,TS val 4044896566 ecr 1908624833], length 0
        0x0000:  4500 0034 0000 4000 4006 0000 7f00 0001  E..4..@.@.......
        0x0010:  7f00 0001 f789 c383 30fc 34f8 324c c9d7  ........0.4.2L..
        0x0020:  8010 18ec fe28 0000 0101 080a f118 3936  .....(........96
        0x0030:  71c3 4dc1                                q.M.
```
</details>

**Comment by digiz3d** [comment]
Did you try non-stream requests?
On my end, they did not work with @grpc/grpc-js > 1.12.6
Ttry downgrading?

Since @grpc/grpc-js@1.13.0 Bun does not seem to work with anymore

**Comment by digiz3d** [comment]
Glad it helped. But still an issue to fix Bun side I guess, or we are stuck with an old version !
